<?xml version="1.0" encoding="UTF-8"?>
<!ELEMENT SystemQueryStock (Given,When,Then)>
<!ELEMENT Given (ItemToQuery)>
<!ELEMENT ItemToQuery (Id)>
<!ELEMENT When (Message)>
<!ATTLIST Message sent (true|false) #REQUIRED>
<!ELEMENT Then (Reply)>
<!ELEMENT Reply (QueriedItem)>
<!ELEMENT QueriedItem (Id, Stock)>

<!ELEMENT Id (#PCDATA)>
<!ELEMENT Message (#PCDATA)>
<!ELEMENT Stock (#PCDATA)>